{
  "specVersion": "1.0",
  "jobId": "123e4567-e89b-42d3-a456-426614174000",
  "inputPath": "/work/in/document.pdf",
  "outputDirectory": "/work/out",
  "mode": "safe_fix",
  "profile": "ua1",
  "explicitLanguage": "en-US",
  "limits": { "maxBytes": 10485760, "maxPages": 20, "timeoutSeconds": 60 }
}
